[
  {
    "window_id": 0,
    "timestamp": "2025-12-08T00:30:27.647896Z",
    "drift_statistic": 0.0,
    "drift_detected": false,
    "adwin_detected": false,
    "baseline_mean": 0.071059,
    "current_mean": 0.071059,
    "current_std": 0.063938,
    "predictions_processed": 100,
    "ground_truth_drift": false
  },
  {
    "window_id": 1,
    "timestamp": "2025-12-08T00:30:33.559064Z",
    "drift_statistic": 0.011232,
    "drift_detected": false,
    "adwin_detected": false,
    "baseline_mean": 0.071059,
    "current_mean": 0.082291,
    "current_std": 0.088738,
    "predictions_processed": 100,
    "ground_truth_drift": false
  },
  {
    "window_id": 2,
    "timestamp": "2025-12-08T00:30:39.573019Z",
    "drift_statistic": 0.429292,
    "drift_detected": true,
    "adwin_detected": true,
    "baseline_mean": 0.071059,
    "current_mean": 0.50035,
    "current_std": 0.320717,
    "predictions_processed": 100,
    "ground_truth_drift": true
  },
  {
    "window_id": 3,
    "timestamp": "2025-12-08T00:30:45.615222Z",
    "drift_statistic": 0.483009,
    "drift_detected": false,
    "adwin_detected": false,
    "baseline_mean": 0.071059,
    "current_mean": 0.554068,
    "current_std": 0.297121,
    "predictions_processed": 100,
    "ground_truth_drift": true
  }
]